line_id,scene_id,start_ms,end_ms,start_tc,en,ja,es,pt,id,ko,tr
L067,S067,289400,294567,00:04:49:12,"Before you post, check if you really should post it.",投稿する前に本当に投稿していいか確認しよう,"Antes de publicar, comprueba si de verdad deberías publicarlo.","Antes de postar, confirme se você realmente deve postar aquilo.","Sebelum mengunggah, pastikan dulu apakah itu benar-benar pantas untuk diunggah.",게시하기 전에 정말 게시해도 되는지 확인하자.,Paylaşmadan önce gerçekten paylaşman gerekip gerekmediğini kontrol et.
L068,S068,294567,298900,00:04:54:17,A photo does not show only your face.,写真に映るのは自分の顔だけではない,Una foto no muestra solo tu cara.,Uma foto não mostra só o seu rosto.,Sebuah foto tidak hanya menampilkan wajahmu.,사진에 찍히는 것은 내 얼굴만이 아니다.,Bir fotoğraf sadece senin yüzünü göstermez.
L069,S069,298900,303467,00:04:58:27,The background may show things you should not show.,背景には見せてはいけないものが映ることがある,En el fondo puede aparecer algo que no deberías mostrar.,O fundo pode mostrar coisas que você não deveria mostrar.,Latar belakang bisa saja menampilkan hal-hal yang seharusnya tidak kamu tunjukkan.,배경에는 보여 주면 안 되는 것이 찍힐 수도 있다.,Arka planda göstermemen gereken şeyler görünebilir.
L070,S070,303467,307867,00:05:03:14,"And if you are at work, the answer is simple.",そして仕事中なら答えはもっと簡単だ,"Y si estás en el trabajo, la respuesta es todavía más simple.","E, se você estiver no trabalho, a resposta é ainda mais simples.","Dan kalau kamu sedang bekerja, jawabannya lebih sederhana lagi.",그리고 근무 중이라면 답은 더 간단하다.,Ve eğer işteysen cevap daha da basittir.
L071,S071,307867,311533,00:05:07:26,Do not post. Do your job.,投稿しない 仕事をする,No publiques. Haz tu trabajo.,Não poste. Trabalhe.,Jangan unggah. Kerjakan pekerjaanmu.,올리지 말고 일을 하자.,Paylaşım yapma. İşini yap.
L072,S072,311533,316600,00:05:11:16,Use your head a little before you use your phone.,スマホを使う前に少しだけ頭を使って考えよう,Usa un poco la cabeza antes de usar el teléfono.,Use um pouco a cabeça antes de usar o celular.,Gunakan sedikit otakmu sebelum menggunakan ponselmu.,스마트폰을 쓰기 전에 먼저 머리를 조금만 써 보자.,Telefonunu kullanmadan önce biraz kafanı kullan.
